{
  "corpus_version": 1,
  "description": "Unedited outputs from ten SymPy pdsolve runs and ten local open-model generations.",
  "name": "PDECert natural-candidate pilot",
  "records": [
    {
      "annotation": {
        "annotators": [],
        "failure_modes": [],
        "rationale": null,
        "status": "pending",
        "verdict": null
      },
      "case": {
        "conditions": [
          {
            "expression": "At(u, t, 0) - sin((1)*pi*x)",
            "name": "initial condition"
          },
          {
            "expression": "At(u, x, 0) - sin((1)*pi*(-(1)*t))",
            "name": "left boundary"
          },
          {
            "expression": "At(u, x, 1) - sin((1)*pi*(1-(1)*t))",
            "name": "right boundary"
          }
        ],
        "domains": {
          "t": [
            0.0,
            1.0
          ],
          "x": [
            0.0,
            1.0
          ]
        },
        "fields": {
          "u": "sin(pi*(-t + x))"
        },
        "name": "advection speed 1, Fourier mode 1",
        "parameters": {},
        "pde_residuals": [
          {
            "expression": "D(u, t) + (1)*D(u, x)",
            "name": "advection PDE"
          }
        ],
        "schema_version": 3,
        "variables": [
          "x",
          "t"
        ]
      },
      "id": "sympy-advection-01",
      "origin": {
        "generated_at": "2026-08-23T22:00:03.853432+00:00",
        "identifier": "sympy.solvers.pde.pdsolve",
        "input": "pdsolve(Eq(Derivative(u(x, t), t) + Derivative(u(x, t), x), 0), u(x, t)); returned Eq(u(x, t), F(-t + x)); specialize its arbitrary F using u(x,0)=sin(1*pi*x), yielding sin(pi*(-t + x))",
        "kind": "symbolic_solver",
        "license": "BSD-3-Clause",
        "producer": "SymPy",
        "revision": null,
        "source_url": "https://docs.sympy.org/latest/modules/solvers/pde.html",
        "version": "1.14.0"
      },
      "output_sha256": "3f6991b3282eb6fde155b596921380b64145ef763fbc200a8952a3dd7cfc1fb7",
      "raw_output": "Eq(u(x, t), F(-t + x))"
    },
    {
      "annotation": {
        "annotators": [],
        "failure_modes": [],
        "rationale": null,
        "status": "pending",
        "verdict": null
      },
      "case": {
        "conditions": [
          {
            "expression": "At(u, t, 0) - sin((2)*pi*x)",
            "name": "initial condition"
          },
          {
            "expression": "At(u, x, 0) - sin((2)*pi*(-(1)*t))",
            "name": "left boundary"
          },
          {
            "expression": "At(u, x, 1) - sin((2)*pi*(1-(1)*t))",
            "name": "right boundary"
          }
        ],
        "domains": {
          "t": [
            0.0,
            1.0
          ],
          "x": [
            0.0,
            1.0
          ]
        },
        "fields": {
          "u": "sin(pi*(-2*t + 2*x))"
        },
        "name": "advection speed 1, Fourier mode 2",
        "parameters": {},
        "pde_residuals": [
          {
            "expression": "D(u, t) + (1)*D(u, x)",
            "name": "advection PDE"
          }
        ],
        "schema_version": 3,
        "variables": [
          "x",
          "t"
        ]
      },
      "id": "sympy-advection-02",
      "origin": {
        "generated_at": "2026-08-23T22:00:03.859081+00:00",
        "identifier": "sympy.solvers.pde.pdsolve",
        "input": "pdsolve(Eq(Derivative(u(x, t), t) + Derivative(u(x, t), x), 0), u(x, t)); returned Eq(u(x, t), F(-t + x)); specialize its arbitrary F using u(x,0)=sin(2*pi*x), yielding sin(pi*(-2*t + 2*x))",
        "kind": "symbolic_solver",
        "license": "BSD-3-Clause",
        "producer": "SymPy",
        "revision": null,
        "source_url": "https://docs.sympy.org/latest/modules/solvers/pde.html",
        "version": "1.14.0"
      },
      "output_sha256": "3f6991b3282eb6fde155b596921380b64145ef763fbc200a8952a3dd7cfc1fb7",
      "raw_output": "Eq(u(x, t), F(-t + x))"
    },
    {
      "annotation": {
        "annotators": [],
        "failure_modes": [],
        "rationale": null,
        "status": "pending",
        "verdict": null
      },
      "case": {
        "conditions": [
          {
            "expression": "At(u, t, 0) - sin((1)*pi*x)",
            "name": "initial condition"
          },
          {
            "expression": "At(u, x, 0) - sin((1)*pi*(-(2)*t))",
            "name": "left boundary"
          },
          {
            "expression": "At(u, x, 1) - sin((1)*pi*(1-(2)*t))",
            "name": "right boundary"
          }
        ],
        "domains": {
          "t": [
            0.0,
            1.0
          ],
          "x": [
            0.0,
            1.0
          ]
        },
        "fields": {
          "u": "sin(pi*(-2*t + x))"
        },
        "name": "advection speed 2, Fourier mode 1",
        "parameters": {},
        "pde_residuals": [
          {
            "expression": "D(u, t) + (2)*D(u, x)",
            "name": "advection PDE"
          }
        ],
        "schema_version": 3,
        "variables": [
          "x",
          "t"
        ]
      },
      "id": "sympy-advection-03",
      "origin": {
        "generated_at": "2026-08-23T22:00:03.865731+00:00",
        "identifier": "sympy.solvers.pde.pdsolve",
        "input": "pdsolve(Eq(Derivative(u(x, t), t) + 2*Derivative(u(x, t), x), 0), u(x, t)); returned Eq(u(x, t), F(-2*t + x)); specialize its arbitrary F using u(x,0)=sin(1*pi*x), yielding sin(pi*(-2*t + x))",
        "kind": "symbolic_solver",
        "license": "BSD-3-Clause",
        "producer": "SymPy",
        "revision": null,
        "source_url": "https://docs.sympy.org/latest/modules/solvers/pde.html",
        "version": "1.14.0"
      },
      "output_sha256": "adf201643dde5d061d4933464c554367913fc4edd787392ea62c43213b08f783",
      "raw_output": "Eq(u(x, t), F(-2*t + x))"
    },
    {
      "annotation": {
        "annotators": [],
        "failure_modes": [],
        "rationale": null,
        "status": "pending",
        "verdict": null
      },
      "case": {
        "conditions": [
          {
            "expression": "At(u, t, 0) - sin((3)*pi*x)",
            "name": "initial condition"
          },
          {
            "expression": "At(u, x, 0) - sin((3)*pi*(-(2)*t))",
            "name": "left boundary"
          },
          {
            "expression": "At(u, x, 1) - sin((3)*pi*(1-(2)*t))",
            "name": "right boundary"
          }
        ],
        "domains": {
          "t": [
            0.0,
            1.0
          ],
          "x": [
            0.0,
            1.0
          ]
        },
        "fields": {
          "u": "sin(pi*(-6*t + 3*x))"
        },
        "name": "advection speed 2, Fourier mode 3",
        "parameters": {},
        "pde_residuals": [
          {
            "expression": "D(u, t) + (2)*D(u, x)",
            "name": "advection PDE"
          }
        ],
        "schema_version": 3,
        "variables": [
          "x",
          "t"
        ]
      },
      "id": "sympy-advection-04",
      "origin": {
        "generated_at": "2026-08-23T22:00:03.871987+00:00",
        "identifier": "sympy.solvers.pde.pdsolve",
        "input": "pdsolve(Eq(Derivative(u(x, t), t) + 2*Derivative(u(x, t), x), 0), u(x, t)); returned Eq(u(x, t), F(-2*t + x)); specialize its arbitrary F using u(x,0)=sin(3*pi*x), yielding sin(pi*(-6*t + 3*x))",
        "kind": "symbolic_solver",
        "license": "BSD-3-Clause",
        "producer": "SymPy",
        "revision": null,
        "source_url": "https://docs.sympy.org/latest/modules/solvers/pde.html",
        "version": "1.14.0"
      },
      "output_sha256": "adf201643dde5d061d4933464c554367913fc4edd787392ea62c43213b08f783",
      "raw_output": "Eq(u(x, t), F(-2*t + x))"
    },
    {
      "annotation": {
        "annotators": [],
        "failure_modes": [],
        "rationale": null,
        "status": "pending",
        "verdict": null
      },
      "case": {
        "conditions": [
          {
            "expression": "At(u, t, 0) - sin((1)*pi*x)",
            "name": "initial condition"
          },
          {
            "expression": "At(u, x, 0) - sin((1)*pi*(-(3)*t))",
            "name": "left boundary"
          },
          {
            "expression": "At(u, x, 1) - sin((1)*pi*(1-(3)*t))",
            "name": "right boundary"
          }
        ],
        "domains": {
          "t": [
            0.0,
            1.0
          ],
          "x": [
            0.0,
            1.0
          ]
        },
        "fields": {
          "u": "sin(pi*(-3*t + x))"
        },
        "name": "advection speed 3, Fourier mode 1",
        "parameters": {},
        "pde_residuals": [
          {
            "expression": "D(u, t) + (3)*D(u, x)",
            "name": "advection PDE"
          }
        ],
        "schema_version": 3,
        "variables": [
          "x",
          "t"
        ]
      },
      "id": "sympy-advection-05",
      "origin": {
        "generated_at": "2026-08-23T22:00:03.878757+00:00",
        "identifier": "sympy.solvers.pde.pdsolve",
        "input": "pdsolve(Eq(Derivative(u(x, t), t) + 3*Derivative(u(x, t), x), 0), u(x, t)); returned Eq(u(x, t), F(-3*t + x)); specialize its arbitrary F using u(x,0)=sin(1*pi*x), yielding sin(pi*(-3*t + x))",
        "kind": "symbolic_solver",
        "license": "BSD-3-Clause",
        "producer": "SymPy",
        "revision": null,
        "source_url": "https://docs.sympy.org/latest/modules/solvers/pde.html",
        "version": "1.14.0"
      },
      "output_sha256": "420f70dfde7379fa3eb44842dd5c8103c245b167dc95e35351ad05553256178d",
      "raw_output": "Eq(u(x, t), F(-3*t + x))"
    },
    {
      "annotation": {
        "annotators": [],
        "failure_modes": [],
        "rationale": null,
        "status": "pending",
        "verdict": null
      },
      "case": {
        "conditions": [
          {